{
  "$schema": "http://json-schema.org/draft-07/schema#",
  "$id": "https://yushimoji.github.io/narrativegen/schema/playthrough.schema.json",
  "title": "NarrativeGen Playthrough Model",
  "type": "object",
  "required": ["modelType", "startNode", "nodes"],
  "definitions": {
    "condition": {
      "oneOf": [
        {
          "type": "object",
          "required": ["type", "key", "value"],
          "properties": {
            "type": { "const": "flag" },
            "key": { "type": "string" },
            "value": { "type": "boolean" }
          },
          "additionalProperties": false
        },
        {
          "type": "object",
          "required": ["type", "key", "op", "value"],
          "properties": {
            "type": { "const": "resource" },
            "key": { "type": "string" },
            "op": { "type": "string", "enum": [">=", "<=", ">", "<", "=="] },
            "value": { "type": "number" }
          },
          "additionalProperties": false
        },
        {
          "type": "object",
          "required": ["type", "key", "op", "value"],
          "properties": {
            "type": { "const": "variable" },
            "key": { "type": "string" },
            "op": { "type": "string", "enum": ["==", "!=", "contains", "!contains", ">=", "<=", ">", "<"] },
            "value": { "oneOf": [{ "type": "string" }, { "type": "number" }] }
          },
          "additionalProperties": false
        },
        {
          "type": "object",
          "required": ["type", "start", "end"],
          "properties": {
            "type": { "const": "timeWindow" },
            "start": { "type": "number" },
            "end": { "type": "number" }
          },
          "additionalProperties": false
        },
        {
          "type": "object",
          "required": ["type", "key", "value"],
          "properties": {
            "type": { "const": "hasItem" },
            "key": { "type": "string" },
            "value": { "type": "boolean" }
          },
          "additionalProperties": false
        },
        {
          "type": "object",
          "required": ["type", "entity", "key", "op", "value"],
          "properties": {
            "type": { "const": "property" },
            "entity": { "type": "string" },
            "key": { "type": "string" },
            "op": { "type": "string", "enum": [">=", "<=", ">", "<", "==", "!="] },
            "value": { "oneOf": [{ "type": "string" }, { "type": "number" }, { "type": "boolean" }] }
          },
          "additionalProperties": false
        },
        {
          "type": "object",
          "required": ["type", "key", "value"],
          "properties": {
            "type": { "const": "hasEvent" },
            "key": { "type": "string" },
            "value": { "type": "boolean" }
          },
          "additionalProperties": false
        },
        {
          "type": "object",
          "required": ["type", "rule", "result"],
          "properties": {
            "type": { "const": "knowledgeRule" },
            "rule": { "type": "string" },
            "result": { "const": "noticed" }
          },
          "additionalProperties": false
        },
        {
          "type": "object",
          "required": ["type", "conditions"],
          "properties": {
            "type": { "const": "and" },
            "conditions": {
              "type": "array",
              "items": { "$ref": "#/definitions/condition" }
            }
          },
          "additionalProperties": false
        },
        {
          "type": "object",
          "required": ["type", "conditions"],
          "properties": {
            "type": { "const": "or" },
            "conditions": {
              "type": "array",
              "items": { "$ref": "#/definitions/condition" }
            }
          },
          "additionalProperties": false
        },
        {
          "type": "object",
          "required": ["type", "condition"],
          "properties": {
            "type": { "const": "not" },
            "condition": { "$ref": "#/definitions/condition" }
          },
          "additionalProperties": false
        }
      ]
    }
  },
  "properties": {
    "modelType": { "type": "string", "enum": ["adventure-playthrough"] },
    "startNode": { "type": "string" },
    "flags": { "type": "object", "additionalProperties": { "type": "boolean" } },
    "resources": { "type": "object", "additionalProperties": { "type": "number" } },
    "variables": { "type": "object", "additionalProperties": { "oneOf": [{ "type": "string" }, { "type": "number" }] } },
    "entities": {
      "type": "object",
      "additionalProperties": {
        "type": "object",
        "required": ["id", "name"],
        "properties": {
          "id": { "type": "string" },
          "name": { "type": "string" },
          "description": { "type": "string" },
          "cost": { "type": "number" },
          "parentEntity": { "type": "string" },
          "properties": {
            "type": "object",
            "additionalProperties": {
              "type": "object",
              "required": ["key", "type"],
              "properties": {
                "key": { "type": "string" },
                "type": { "type": "string", "enum": ["string", "number", "boolean"] },
                "defaultValue": { "oneOf": [{ "type": "string" }, { "type": "number" }, { "type": "boolean" }] },
                "rangeMin": { "type": "number" },
                "rangeMax": { "type": "number" },
                "labels": { "type": "array", "items": { "type": "string" } }
              },
              "additionalProperties": false
            }
          }
        },
        "additionalProperties": false
      }
    },
    "nodes": {
      "type": "object",
      "additionalProperties": {
        "type": "object",
        "required": ["id"],
        "properties": {
          "id": { "type": "string" },
          "text": { "type": "string" },
          "speaker": { "type": "string" },
          "choices": {
            "type": "array",
            "items": {
              "type": "object",
              "required": ["id", "text", "target"],
              "properties": {
                "id": { "type": "string" },
                "text": { "type": "string" },
                "target": { "type": "string" },
                "conditions": {
                  "type": "array",
                  "items": { "$ref": "#/definitions/condition" }
                },
                "effects": {
                  "type": "array",
                  "items": {
                    "oneOf": [
                      {
                        "type": "object",
                        "required": ["type", "key", "value"],
                        "properties": {
                          "type": { "const": "setFlag" },
                          "key": { "type": "string" },
                          "value": { "type": "boolean" }
                        },
                        "additionalProperties": false
                      },
                      {
                        "type": "object",
                        "required": ["type", "key", "delta"],
                        "properties": {
                          "type": { "const": "addResource" },
                          "key": { "type": "string" },
                          "delta": { "type": "number" }
                        },
                        "additionalProperties": false
                      },
                      {
                        "type": "object",
                        "required": ["type", "key", "value"],
                        "properties": {
                          "type": { "const": "setVariable" },
                          "key": { "type": "string" },
                          "value": { "oneOf": [{ "type": "string" }, { "type": "number" }] }
                        },
                        "additionalProperties": false
                      },
                      {
                        "type": "object",
                        "required": ["type", "key", "op", "value"],
                        "properties": {
                          "type": { "const": "modifyVariable" },
                          "key": { "type": "string" },
                          "op": { "type": "string", "enum": ["+", "-", "*", "/"] },
                          "value": { "type": "number" }
                        },
                        "additionalProperties": false
                      },
                      {
                        "type": "object",
                        "required": ["type", "target"],
                        "properties": {
                          "type": { "const": "goto" },
                          "target": { "type": "string" }
                        },
                        "additionalProperties": false
                      },
                      {
                        "type": "object",
                        "required": ["type", "key"],
                        "properties": {
                          "type": { "const": "addItem" },
                          "key": { "type": "string" }
                        },
                        "additionalProperties": false
                      },
                      {
                        "type": "object",
                        "required": ["type", "key"],
                        "properties": {
                          "type": { "const": "removeItem" },
                          "key": { "type": "string" }
                        },
                        "additionalProperties": false
                      },
                      {
                        "type": "object",
                        "required": ["type", "id", "name"],
                        "properties": {
                          "type": { "const": "createEvent" },
                          "id": { "type": "string" },
                          "name": { "type": "string" },
                          "properties": {
                            "type": "object",
                            "additionalProperties": {
                              "type": "object",
                              "required": ["defaultValue"],
                              "properties": {
                                "defaultValue": { "oneOf": [{ "type": "string" }, { "type": "number" }, { "type": "boolean" }] }
                              },
                              "additionalProperties": false
                            }
                          }
                        },
                        "additionalProperties": false
                      },
                      {
                        "type": "object",
                        "required": ["type", "character", "entity", "domain", "expectations"],
                        "properties": {
                          "type": { "const": "perceiveEntity" },
                          "character": { "type": "string" },
                          "entity": { "type": "string" },
                          "domain": { "type": "string" },
                          "expectations": {
                            "type": "object",
                            "additionalProperties": { "type": "number" }
                          },
                          "eventId": { "type": "string" },
                          "eventName": { "type": "string" },
                          "onlyIfNoticed": { "type": "boolean" }
                        },
                        "additionalProperties": false
                      }
                    ]
                  }
                },
                "outcome": {
                  "type": "object",
                  "required": ["type", "value"],
                  "properties": {
                    "type": { "type": "string" },
                    "value": { "type": "string" }
                  },
                  "additionalProperties": false
                }
              },
              "additionalProperties": false
            }
          },
          "presentation": {
            "type": "object",
            "properties": {
              "transition": { "type": "string" },
              "image": { "type": "string", "description": "Scene image URL (relative or absolute)" },
              "bgm": {
                "oneOf": [
                  { "type": "string", "description": "BGM audio URL" },
                  { "type": "null", "description": "Explicitly stop BGM" }
                ]
              }
            },
            "additionalProperties": false
          }
        },
        "additionalProperties": false
      }
    },
    "settings": {
      "type": "object",
      "properties": {
        "presentation": {
          "type": "object",
          "properties": {
            "defaultTransition": { "type": "string", "enum": ["crossfade", "append-scroll"] },
            "paragraphDelay": { "type": "number", "minimum": 0 },
            "transitionDuration": { "type": "number", "minimum": 0 },
            "defaultBgm": { "type": "string", "description": "Default BGM URL for the model" },
            "bgmVolume": { "type": "number", "minimum": 0, "maximum": 1, "description": "BGM volume (0-1, default 0.5)" },
            "bgmCrossfadeDuration": { "type": "number", "minimum": 0, "description": "BGM crossfade duration in ms (default 1000)" }
          },
          "additionalProperties": false
        }
      },
      "additionalProperties": false
    },
    "characters": {
      "type": "object",
      "additionalProperties": {
        "type": "object",
        "required": ["id", "name", "knowledgeProfiles"],
        "properties": {
          "id": { "type": "string" },
          "name": { "type": "string" },
          "knowledgeProfiles": {
            "type": "array",
            "items": {
              "type": "object",
              "required": ["domain"],
              "properties": {
                "domain": { "type": "string" },
                "accuracy": { "type": "number" },
                "tolerance": { "type": "number" }
              },
              "additionalProperties": false
            }
          }
        },
        "additionalProperties": false
      }
    },
    "knowledgeRules": {
      "type": "object",
      "additionalProperties": {
        "type": "object",
        "required": ["character", "entity", "domain", "expectations"],
        "properties": {
          "character": { "type": "string" },
          "entity": { "type": "string" },
          "domain": { "type": "string" },
          "expectations": {
            "type": "object",
            "minProperties": 1,
            "additionalProperties": { "type": "number" }
          }
        },
        "additionalProperties": false
      }
    },
    "perceptionPolicies": {
      "type": "array",
      "items": {
        "type": "object",
        "required": ["id", "trigger", "character", "entity", "domain", "expectations"],
        "properties": {
          "id": { "type": "string" },
          "trigger": {
            "type": "object",
            "required": ["node"],
            "properties": {
              "node": { "type": "string" }
            },
            "additionalProperties": false
          },
          "character": { "type": "string" },
          "entity": { "type": "string" },
          "domain": { "type": "string" },
          "expectations": {
            "type": "object",
            "additionalProperties": { "type": "number" }
          },
          "eventId": { "type": "string" },
          "eventName": { "type": "string" },
          "onlyIfNoticed": { "type": "boolean" }
        },
        "additionalProperties": false
      }
    },
    "paraphraseLexicon": {
      "type": "object",
      "additionalProperties": {
        "type": "array",
        "items": {
          "oneOf": [
            { "type": "string" },
            {
              "type": "object",
              "required": ["text"],
              "properties": {
                "text": { "type": "string" },
                "match": { "type": "object", "additionalProperties": { "oneOf": [{ "type": "string" }, { "type": "number" }, { "type": "boolean" }] } },
                "weight": { "type": "number" }
              },
              "additionalProperties": false
            }
          ]
        }
      }
    },
    "conversationTemplates": {
      "type": "array",
      "items": {
        "type": "object",
        "required": ["id", "trigger", "text"],
        "properties": {
          "id": { "type": "string" },
          "trigger": {
            "type": "object",
            "properties": {
              "eventMatch": {
                "type": "object",
                "required": ["propertyChecks"],
                "properties": {
                  "propertyChecks": {
                    "type": "array",
                    "items": {
                      "type": "object",
                      "required": ["key", "op", "value"],
                      "properties": {
                        "key": { "type": "string" },
                        "op": { "type": "string", "enum": [">=", "<=", ">", "<", "==", "!="] },
                        "value": { "oneOf": [{ "type": "string" }, { "type": "number" }, { "type": "boolean" }] }
                      },
                      "additionalProperties": false
                    }
                  }
                },
                "additionalProperties": false
              },
              "sessionConditions": {
                "type": "array",
                "items": { "$ref": "#/definitions/condition" }
              }
            },
            "additionalProperties": false
          },
          "text": { "type": "string" },
          "insertContext": { "type": "string" },
          "priority": { "type": "number" },
          "maxUses": { "type": "number" }
        },
        "additionalProperties": false
      }
    }
  },
  "additionalProperties": false
}
